https://headlines.yahoo.co.jp/hl?a=20181003-00000013-gamespav-game,ステルスアクション『The Slater』「一部のキャラクターたちは映画の登場人物からインスパイア」【注目インディーミニ問答】,気になる新作インディーゲームの開発者にインタビューする本企画。今回は、Laina Interactive開発、PC向けに9月20日リリースされたステルスアクション『The Slater』開発者へのミニインタビューをお届けします。大きな写真で詳しく見る本作は、元警官の復讐劇を描くステルスアクション。ドラッグの捜査をしていた父は殺され、Mark Slaterはその死に関与した人間を一人一人暗殺していきます。ゲームは一人称視点で展開し、誰をどうやって暗殺するか、見張りをどうやってすりぬけるか、パズル的な要素も含まれています。記事執筆時点で日本語には未対応。『The Slater』は1,520円で配信中。――まずは自己紹介をお願いします。Alessandro Laina氏（以下Laina氏）：フィンランドのヘルシンキに住んでいるAlessandro Lainaです。ゲーム業界で10年ほど仕事をしており、本作は私が単独で開発した最初のプロジェクトとなります。――本作の開発はいつどのようにして始まったのでしょうか？Laina氏：本作の開発は3年前に趣味のプロジェクトとして始まりました。私一人でどれだけできるのか、試してみたかったのです。当初、現在のものほど巨大なプロジェクトになるはずではありませんでしたが、新たなものを学んでいく過程で、次第に大きくなってしまいました。――本作の特徴を教えてください。Laina氏：皆殺ししてはいけない暗殺ゲーム、と言うのはそれほど多くないのではないでしょうか。本作では、誰を暗殺するのか考える必要があり、その際に絶対見つかってはいけませんし、死体が見つかってもいけません。見つかれば、すぐに殺されてしまいます。また、一人称視点も新しさがあるのではないでしょうか。――本作が影響を受けた作品はありますか？Laina氏：本作は暗殺ゲームを中心に、数多くのゲームから多大な影響を受けています。カットシーンは映画からの影響が大きく、一部のキャラクターたちは映画の登場人物からインスパイアされています。本作のようなゲームを作る上で、他のゲームや映画から影響されないと言うのは無理でしょう。ゲームや映画は私のこれまでの人生における大きな部分ですし、たくさんの影響を受けて育ちました。――本作の日本語対応予定はありますか？Laina氏：残念ながら本作は英語にのみ対応しており、今後他の言語に翻訳されるかは現時点でわかりません。――最後に日本の読者にメッセージをお願いします。Laina氏：本作を購入していただいた皆さん、そして本作に興味を持ってくださった皆さん、ありがとうございます。もし興味を持っていただけたようでしたら、本作をご購入いただくことで、今後もゲーム開発を続けることができるでしょう。――ありがとうございました。
https://headlines.yahoo.co.jp/hl?a=20181003-00000011-isd-game,DeNAがスマートフォン向け新作タイトル『進撃の巨人TACTICS』を正式発表！ゲーム画面が確認できるTVCMも公開,【今冬配信予定】『進撃の巨人TACTICS』公式アカウントです。今後、ゲームに関する情報をお届けいたしますので、続報をお待ちください！ ＃進撃の巨人 ＃ゲキタクhttps://t.co/LyMUomzluX pic.twitter.com/bQoTOZ5c5G＆mdash; 【今冬配信予定】進撃の巨人TACTICS公式 (@ShingekiTactics) 2018年10月1日DeNAは、数日前から発表していた『進撃の巨人』新作スマートフォン向けゲームアプリに関して、正式タイトルを『進撃の巨人TACTICS』に決定し、本作の公式Twitterアカウントを開設しています。さらに、ゲーム画面が確認できるTVCMも公開。どうやら調査兵団のキャラクターたちを使って、迫りくる巨人から拠点を守るようなゲームになっているようです。『進撃の巨人TACTICS』は、2018年冬に配信を予定していますので、お楽しみに！■ティザーサイトはこちらURL：https://shingeki-tactics.jp/■公式TwitterアカウントはこちらURL：https://twitter.com/ShingekiTactics＆copy;諫山創・講談社／「進撃の巨人」製作委員会＆copy;DeNA
https://headlines.yahoo.co.jp/hl?a=20181003-00000017-ignjapan-game,セリフや字幕を廃したシネマティックアクション『THE QUIET MAN』の配信日が11月1日に決定！,スクウェア・エニックスはPS4/PC（Steam）でリリース予定の『THE QUIET MAN』の最新トレーラーを公開し、配信日は2018年11月1日だと発表した。価格は1800円（税別）。「THE QUIET MAN」画像・動画ギャラリー『THE QUIET MAN』は、実写で描かれるストーリーパートとCGで表現されるアクションパートで構成されるシネマティックアクションゲーム。クワイエットというタイトル通り、本作には一部を除いて音楽やセリフ、字幕による情報伝達手段がない。プレイヤーは目の前で起こっていることからストーリーを考察していくという、独特なゲーム体験になっているのだ。舞台は、眠らない大都市・ニューヨーク。「Club Moonrise」の歌姫であるララはナイトクラブのシンガーとしてその夜も活躍するはずだったが、突如現れた仮面の男に連れ去られてしまう。ララを救出すべく、主人公のデインはニューヨークの街を奔走するというストーリーだ。公式にプレイ時間は約3時間と明言されており、フォトリアルなCGの追及など密度の濃いゲームになっている。また、シネマティックアクションゲームというだけあって、本作にはコンバットアクションもある。攻撃を行いメーターを溜めると、フォーカスモードに移行。その状態からさまざまなアクションが行えて、フィニッシュムーブができる。また、本作は発売からおよそ1週間後に無料アップデート「THE QUIET MAN −ANSWERED−」が配信される。こちらは音と言葉を宿した2周目になっている。言葉を捨てた1周目と言葉を宿した2周目をプレイして、初めて本作の体験が完結する模様だ。配信日にプレイし、考察しながら2周目のアップデートを待つというのは唯一無二の体験になりそうだ。公式サイトには、本作のプロデューサーである藤永健生氏のコメントが掲載されている。本作はスクウェア・エニックスが送る極めてインディーなタイトルになっているとのこと。興味のある人は公式サイトをチェックしてほしい。
https://headlines.yahoo.co.jp/hl?a=20181003-00000007-famitsu-game,【Amazon予約数ランキング】発売迫る『CoD ブラックオプス4』が1位！ 購入キャンペーンスタートでさらに加速【9/23〜9/29】,Amazon.co.jp TVゲームストアの予約数ランキングをお届けするこのコーナー。Amazon.co.jpにて、集計週に予約が多く集まったタイトルのラインアップをもとに、ゲーム業界のトレンドを分析していこう。（集計期間：2018年9月23日〜9月29日）2018年10月12日の発売が迫ったプレイステーション4用ソフト『コール オブ デューティ ブラックオプス4』が好調。前回2位から1位へと順位がアップしている。10月1日からは、プレイステーション4 Proとセットで購入すると5000円OFFキャンペーンが始まっており、好調さがさらに加速しそうだ。【PS4】コール オブ デューティ ブラックオプス 4【5,000円OFF】PlayStation 4 Pro本体とコール オブ デューティ ブラックオプス 4がセットでお買い得 キャンペーンページ1位【PS4】コール オブ デューティ ブラックオプス 42位【PS4】ACE COMBAT 7: SKIES UNKNOWN3位【Switch】スーパー マリオパーティ4位【Switch】大乱闘スマッシュブラザーズ SPECIAL5位【PS4】キングダム ハーツIII6位【PS4】ACE COMBAT 7: SKIES UNKNOWN COLLECTOR'S EDITION7位【PS4】ACE COMBAT 7: SKIES UNKNOWN COLLECTOR'S EDITION【Amazon.co.jp限定】 PS4用オリジナルテーマをダウンロードできるプロダクトコード8位【PS4】レッド・デッド・リデンプション29位【PS4】キャサリン・フルボディ ダイナマイト・フルボディ BOX10位【PS4】デビル メイ クライ 511位【PS4】SEKIRO: SHADOWS DIE TWICE12位【PS4】デビル メイ クライ 5【Amazon.co.jp限定】「デビルブレイカーDLC:モンキービジネス」ダウンロードコード 配信 付13位【PS4】アサシン クリード オデッセイ14位【PS4】JUDGE EYES (ジャッジ アイズ) :死神の遺言15位【PS4】BIOHAZARD RE:2 Z Version16位【3DS】ペルソナQ2 ニュー シネマ ラビリンス17位【PS4】ACE COMBAT 7: SKIES UNKNOWN【Amazon.co.jp限定】 PS4用オリジナルテーマをダウンロードできるプロダクトコード (配信)18位【PS4】コール オブ デューティ ブラックオプス 4【早期購入特典】「1,100 Call of Duty ポイント」がダウンロード可能なコードチラシ (封入) 【Amazon.co.jp限定】コーリングカード配信【CEROレーティング「Z」】19位【PS4】アサシン クリード オデッセイ ゴールドエディション20位【PS4】GOD EATER 3 初回限定生産版【早期購入特典】主人公着せ替え衣装「ヴァジュラくん[獣神]」をダウンロードできるプロダクトコード (封入) 【初回限定生産版特典】主人公着せ替え衣装「ヴァジュラくん[帝王]」をダウンロードできるプロダクトコード (封入)21位【PS4】ドラゴンクエストビルダーズ2 破壊神シドーとからっぽの島22位【PS4】GOD EATER 323位【PS4】レッド・デッド・リデンプション2:スペシャル・エディション24位【PS4】Fallout 76 Tricentennial Edition (トライセンテニアルエディション)25位【Switch】ポケットモンスター Let's Go! イーブイ モンスターボール Plusセット26位【PS4】キングダム ハーツIII 【Amazon.co.jp限定】 オリジナルPS4用テーマ(Amazon) 配信27位【PS4】JUDGE EYES (ジャッジ アイズ) :死神の遺言 【Amazon.co.jp限定】アイテム未定 付28位【Switch】ポケットモンスター Let's Go! ピカチュウ29位【PS4】絶体絶命都市4Plus -Summer Memories-30位【Switch】New スーパーマリオブラザーズ U デラックス
https://headlines.yahoo.co.jp/hl?a=20181003-00000010-isd-game,秋からスマホでスタァライトするんですね、わかります…。『少女☆歌劇 レヴュースタァライト -Re LIVE-』の最新情報が明らかになったステージイベントをレポート【TGS2018】,東京ゲームショウ 2018の開催3日目となる9月22日、ブシロードブースのステージで「少女☆歌劇 レヴュースタァライト -Re LIVE- TGS2018 スペシャルステージ」が開催されました。キャストが登壇したステージの模様と、そこで明らかになったスマートフォンアプリ『少女☆歌劇 レヴュースタァライト -Re LIVE-（以下『スタリラ』）』の最新情報をお届けします。【関連画像】『少女☆歌劇 レヴュースタァライト』は、ミュージカルとアニメを起点に、さまざまなメディアで展開されるプロジェクト。2017年9月にミュージカルとライブで構成された舞台が上演され、2018年7月からは同名のTVアニメが全12話で放送、メインキャラクター9名はミュージカルもアニメも同じキャストが演じています。どちらのメディアでも、スタァを目指して歌やダンス、芝居の練習にはげむ”舞台少女”たちの日常と、広大な謎の地下空間で舞台少女同士が刃をまじえる”レヴュー”という非日常的な光景の2つが軸となり、物語に深みを与えています。そうした世界設定は共有されている『スタリラ』の見どころは「完全オリジナルの新作ストーリー」、「フル3Dのバトル」、「新曲を含む、舞台少女たちによる楽曲の数々」とのこと。プロデューサーの尾関高志氏が進行を務め、愛城華恋役の小山百代さんと石動双葉役の生田輝さんが実機でさまざまな要素を体験しました。写真左：左から順に、双葉役の生田輝さん、華恋役の小山百代さん写真右：生田さん演じる双葉は、しっかり者ながら小柄な女の子。アプリでも華恋との身長差がしっかり表現されているのを確認して「頭上の余白が華恋より広い！小柄でかわいい！」と大はしゃぎゲームの基本的な流れは、物語を楽しむアドベンチャーパートと、いわゆる”バトル”にあたるレヴューパートが交互に挿入されるオーソドックスなスタイルで、そこに舞台少女たちとの交流や育成、サブストーリーの収集、舞台少女たちが日常を過ごす空間を自由に彩れる”マイシアター”などのやり込み要素が加わります。ステージでは、TVアニメでのレヴュー時とは異なる衣裳に身を包んだメインキャラクター9人の新ビジュアルも公開。本作での舞台少女はさまざまな役を演じるために何種類もの衣裳に身を包むそうで、今回のビジュアルは騎士がモチーフとなっているそうです。新衣裳をまとった舞台少女を手に入れられれば、ホーム画面、マイシアター、戦闘時……とあらゆるシーンにその衣裳が適用されるうえ、ボイスも専用のものになっているそうです。◆リアルタイム対人戦「VSレヴュー」でキャストたちが対戦！TGS2018開催初日に続く2回目となる本ステージでは、さらなる新情報としてリアルタイム対人戦となる「VSレヴュー」が発表されました。まずは、舞台少女5人でチームを編成。バトルはターン制で、最初にいわゆる行動コストであるAPが6以内に収まるように攻撃する舞台少女を指定。それがおたがいに終わったら、3Dキャラによる戦闘が1ターンずつ展開します。小山さんが演じる華恋と生田さんが演じる双葉は聖翔音楽学園の仲間ということもあり、ここで本作オリジナル校であるシークフェルト音楽学院に通う雪代晶を演じる野本ほたるさんと、鳳ミチルを演じる尾崎由香さんが登場。聖翔音楽学園対シークフェルト音楽学院というコンセプトで、生田さんと野本さん、小山さんと尾崎さんが対戦。それぞれ生田さんと尾崎さんが勝利を収めました。写真左：雪代晶役の野本ほたるさん写真右：鳳ミチル役の尾崎由香さん最後に小山さんは「やり込み要素がたくさんあって、（VSレヴューで）みなさんと対戦できるのも今から楽しみです。10月13日からは舞台の「少女☆歌劇 レヴュースタァライト -The LIVE- ＃2 Transition」もありますので、ぜひそちらにも来てください！」とコメントし、ステージを締めくくりました。株式会社ブシロードによるスマートフォンアプリ『少女☆歌劇 レヴュースタァライト -Re LIVE-』は現在、公式サイトなどで事前登録を受け付け中。登録者数は9月25日現在で70万人に到達。99万人が達成されると、抽選で1名に好きな舞台少女のデザインをあしらった特製の超巨大グラフィックタオルがプレゼントされます。正式リリースは今秋予定となっていますので、気になる方は忘れないうちに事前登録を済ませておきましょう。(C) Project Revue Starlight (C) 2018 Ateam Inc. (C) TBS(JAPAN) (C) bushiroad All Rights Reserved.
https://headlines.yahoo.co.jp/hl?a=20181003-00000132-impress-game,「ペルソナQ2」、「喜多川祐介」紹介映像を公開！,アトラスは、11月29日に発売を予定しているニンテンドー3DS用3DダンジョンRPG「ペルソナQ2 ニュー シネマ ラビリンス」に登場する「喜多川祐介」の紹介映像を公開した。【この記事に関する別の画像を見る】「喜多川祐介」は「ペルソナ5」に登場する怪盗団の一員。怪盗に扮した際「フォックス」と呼ばれる彼は、独特の感性を持ち浮世離れした絵師。そのツッコミどころの多さは本作でも健在のよう。【喜多川祐介（CV.杉田智和）】ATLUS SEGA All Rights Reserved.
https://headlines.yahoo.co.jp/hl?a=20181003-00000009-isd-game,『スプラトゥーン2』次回フェス「トリック vs トリート」はハロウィン仕様！ テンタクルズやステージもお祭り気分─特別な仮装ギアもプレゼント,フェス開催のお知らせだ。10月は「Splatoween」と題し、特別仕様の世界合同ハロウィンフェスが開催される。期間は10月19日（金）17：00〜10月21日（日）17：00の48時間。このフェスの期間中は、街の様子もおどろおどろしく様変わりするぞ。 pic.twitter.com/TgXb594WNn＆mdash; Splatoon（スプラトゥーン） (@SplatoonJP) 2018年10月3日『スプラトゥーン』公式Twitterアカウントにて、ニンテンンドースイッチソフト『スプラトゥーン2』で実施する世界合同ハロウィンフェスが発表され、その概要が明らかとなりました。イカとヒトの姿を使い分け、移動と攻撃を切り替えて地形をインクで染めていく、ユニークな対戦アクション『スプラトゥーン2』。定期的なアップデートに加え、ユニークなお題で戦う「フェス」の実施、大型DLC「オクト・エキスパンション」の配信など、様々な展開により刺激溢れる楽しさを随時提供しています。「Splatoween」開催中の48時間は、ハイカラスクエアの随所に飾り付けがされて、ハロウィンのお祭り気分を盛り上げる。テンタクルズもちょっとお色直し。ジャッジくんやコジャッジくん、クラゲなど、街の住人もノリノリで扮装しているぞ。 pic.twitter.com/nuuk1FHq1S＆mdash; Splatoon（スプラトゥーン） (@SplatoonJP) 2018年10月3日この10月は「Splatoween」と題し、いつもとはひと味異なる特別仕様の世界合同ハロウィンフェスを実施。フェスの期間中は街の彩りも「Splatoween」仕様となり、お色直ししたテンタクルズや、ユニークな扮装に身を包むジャッジくんや街の住人などを目にすることができます。フェスのお題は「どっちを選ぶ？ トリック vs トリート」。「トリック・オア・トリート」は「お菓子をくれないとイタズラするぞ」というハロウィンの決まり文句。イタズラや仮装で人を驚かせて楽しむか、お菓子をもらってホクホクするか。キミならどちらを選ぶだろうか？ pic.twitter.com/1WErkSTpfK＆mdash; Splatoon（スプラトゥーン） (@SplatoonJP) 2018年10月3日フェスの開催期間は、10月19日17：00から10月21日17：00までの48時間。お題は「どっちを選ぶ？ トリック vs トリート」となっており、イタズラ派とお菓子派による激戦が展開します。今回のフェスでは特別に、ゲームで使える特別な仮装ギアを、Nintendo Switch本体のゲームニュース「イカ研究所通信」を通じてプレゼント！このニュースは10月5日夕方から順次配信されるので、是非仮装して「Splatoween」にご参加いただきたい。 pic.twitter.com/3YgjaEtASR＆mdash; Splatoon（スプラトゥーン） (@SplatoonJP) 2018年10月3日仮装ギアを受け取るには、本体のゲームニュースで「イカ研究所通信」をチャンネル登録し、該当のニュースからソフトを起動する必要がある。このニュースはしばらく経つと閲覧できなくなるので、見つけたら早めにお受け取りいただきたい。＆mdash; Splatoon（スプラトゥーン） (@SplatoonJP) 2018年10月3日しかも今回のフェスでは、ニンテンドースイッチ本体に届くゲームニュース「イカ研究所通信」を通じて、特別な仮装ギアがもらえます。事前に「イカ研究所通信」をチャンネル登録して、10月5日夕方頃から順次発送されるニュースをチェックし、この個性溢れるギアを入手しましょう。さらに、フェス開催中はステージも「Splatoween」仕様。全ステージが専用のグラフィティで飾り付けられているので、バトル中はもちろん、さんぽなどでじっくり見て周るのも一興だ。48時間限定のお祭り、ご都合に合わせてご参加いただきたい。ゲーム内の告知は近日中に行われるのでお楽しみに。 pic.twitter.com/yIAGmSCdT3＆mdash; Splatoon（スプラトゥーン） (@SplatoonJP) 2018年10月3日また、フェス開催中はステージにも変化が。全ステージが「Splatoween」仕様となり、華やかな装飾が施されます。48時間だけのお祭り騒ぎ、どうぞお見逃しなく。
